{
  "$schema": "https://json-schema.org/draft/2020-12/schema",
  "$id": "urn:ai-sow:generate-story:delivery:0.4",
  "type": "object",
  "additionalProperties": false,
  "required": ["stories", "acceptanceCriteria", "integrations", "assumptions"],
  "properties": {
    "stories": {"type": "array", "items": {"$ref": "#/$defs/story"}, "description": "归属于单一 Feature、可独立交付、验收和结算的结果型 Story。"},
    "acceptanceCriteria": {"type": "array", "items": {"$ref": "#/$defs/acceptanceCriterion"}, "description": "按 Story 有序列出的独立、可观察且可判定通过或不通过的验收结果。"},
    "integrations": {"type": "array", "items": {"$ref": "#/$defs/integration"}, "description": "有证据支持并由 Story 交付的集成边界、方向、责任与设计决策关系。"},
    "assumptions": {"type": "array", "items": {"$ref": "#/$defs/assumption"}, "description": "供 Story 单项引用的 Assumption 或 Risk；同一条目可以被多个 Story 引用。"}
  },
  "$defs": {
    "id": {"type": "string", "pattern": "^[a-z][a-z0-9]*(?:-[a-z0-9]+)+$"},
    "storyId": {"type": "string", "pattern": "^story-[a-z0-9]+(?:-[a-z0-9]+)*$"},
    "acceptanceCriterionId": {"type": "string", "pattern": "^ac-[a-z0-9]+(?:-[a-z0-9]+)*$"},
    "integrationId": {"type": "string", "pattern": "^integration-[a-z0-9]+(?:-[a-z0-9]+)*$"},
    "assumptionId": {"type": "string", "pattern": "^assumption-[a-z0-9]+(?:-[a-z0-9]+)*$"},
    "featureId": {"type": "string", "pattern": "^feature-[a-z0-9]+(?:-[a-z0-9]+)*$"},
    "commitmentId": {"type": "string", "pattern": "^commitment-[a-z0-9]+(?:-[a-z0-9]+)*$"},
    "designDecisionId": {"type": "string", "pattern": "^decision-[a-z0-9]+(?:-[a-z0-9]+)*$"},
    "integration": {
      "type": "object",
      "additionalProperties": false,
      "required": ["integrationId", "name", "storyId", "source", "target", "trigger", "direction", "purpose", "owner", "deliveryBoundary", "targetKind", "decisionIds"],
      "properties": {
        "integrationId": {"$ref": "#/$defs/integrationId", "description": "由 Story Owner 维护并供后续 Integration Task 引用的稳定 ID。"},
        "name": {"type": "string", "minLength": 1, "description": "面向业务评审展示的集成名称。"},
        "storyId": {"$ref": "#/$defs/storyId", "description": "交付该集成结果和责任边界的 Story ID。"},
        "source": {"type": "string", "minLength": 1, "description": "集成交换的发送方系统、组件或参与者。"},
        "target": {"type": "string", "minLength": 1, "description": "集成交换的单一接收端口、适配器、系统或提供方；横切 TECHNICAL Story 不聚合相关 BUSINESS Story 已登记的多个提供方目标。"},
        "trigger": {"type": "string", "minLength": 1, "description": "触发交换的事件、调用、计划或人工动作。"},
        "direction": {"type": "string", "enum": ["INBOUND", "OUTBOUND"], "description": "相对于本项目范围内系统的集成方向。"},
        "purpose": {"type": "string", "minLength": 1, "description": "该交换必须实现且不与其他 Story 重复计价的业务、共享技术或运营结果。"},
        "owner": {"type": "string", "enum": ["INTERNAL", "EXTERNAL"], "description": "对目标边界、接入条件和运行结果负责的一方。"},
        "deliveryBoundary": {"type": "string", "enum": ["PORT_ONLY", "END_TO_END"], "description": "Story 交付止于稳定端口还是覆盖到目标系统或提供方的端到端结果。"},
        "targetKind": {"type": "string", "enum": ["PORT", "ADAPTER", "SYSTEM", "PROVIDER"], "description": "用于澄清交付目标是端口、适配器、完整系统还是外部提供方。"},
        "decisionIds": {"type": "array", "uniqueItems": true, "items": {"$ref": "#/$defs/designDecisionId"}, "description": "批准该集成边界或目标的 Design Decision ID；没有类型化设计义务时可为空。"},
        "decisionRationale": {"type": "string", "minLength": 1, "description": "仅当 decisionIds 为空时必填，说明该集成为何不需要类型化 Design Decision。"}
      },
      "allOf": [
        {
          "if": {
            "properties": {"decisionIds": {"maxItems": 0}},
            "required": ["decisionIds"]
          },
          "then": {"required": ["decisionRationale"]}
        }
      ]
    },
    "story": {
      "type": "object",
      "additionalProperties": false,
      "required": ["storyId", "featureId", "name", "description", "uatRelevant", "requiredIntegrationBoundary"],
      "properties": {
        "storyId": {"$ref": "#/$defs/storyId", "description": "由 Story Owner 维护并供 AC、Integration、Assumption 和 Task 引用的稳定 ID。"},
        "featureId": {"$ref": "#/$defs/featureId", "description": "该 Story 恰好归属的 IN_SCOPE BUSINESS 或 TECHNICAL Feature ID。"},
        "name": {"type": "string", "minLength": 1, "description": "以可交付业务或技术结果命名的 Story 标题。"},
        "description": {"type": "string", "minLength": 1, "description": "说明完成后可观察的结果与责任边界，不描述实现 Task。"},
        "assumptionId": {"$ref": "#/$defs/assumptionId", "description": "可选：最能证明该 Story 不确定性的一条 Assumption/Risk ID；同一条目可以被多个 Story 引用。"},
        "uatRelevant": {"type": "boolean", "description": "该 Story 是否属于获批业务 UAT 分母；纯技术上线工作通常不属于。"},
        "requiredIntegrationBoundary": {"type": "string", "enum": ["NONE", "PORT_ONLY", "END_TO_END"], "description": "该 Story 是否必须交付集成，以及止于端口还是端到端目标。"}
      }
    },
    "acceptanceCriterion": {
      "type": "object",
      "additionalProperties": false,
      "required": ["acceptanceCriterionId", "storyId", "sequence", "name", "gapRationale", "carryForwardCommitmentIds", "decisionGate", "approvalDecisionIds"],
      "properties": {
        "acceptanceCriterionId": {"$ref": "#/$defs/acceptanceCriterionId", "description": "由 Story Owner 维护并供 Task 覆盖引用的稳定 AC ID。"},
        "storyId": {"$ref": "#/$defs/storyId", "description": "该验收结果所属的 Story ID。"},
        "sequence": {"type": "integer", "minimum": 1, "description": "同一 Story 内评审和验收该结果的连续顺序。"},
        "name": {"type": "string", "minLength": 1, "description": "可独立观察并明确判定通过或不通过的验收条件名称。"},
        "gapRationale": {"type": "string", "minLength": 1, "description": "说明该 AC 为什么属于目标与 Effective Start 之间的业务差值，并引用相关 Effective Start ID 或明确不存在有效起点。"},
        "carryForwardCommitmentIds": {"type": "array", "uniqueItems": true, "items": {"$ref": "#/$defs/commitmentId"}, "description": "该 AC 逐条承接的 As-Is CARRY_FORWARD Commitment ID；不相关时为空。"},
        "decisionGate": {"type": "string", "enum": ["NOT_REQUIRED", "REQUIRED"], "description": "达成该结果是否必须先取得已列明 Design Decision 的批准。"},
        "approvalDecisionIds": {"type": "array", "uniqueItems": true, "items": {"$ref": "#/$defs/designDecisionId"}, "description": "该 AC 通过前必须获批的 Design Decision ID；无需决策时为空。"}
      },
      "allOf": [
        {
          "if": {"properties": {"decisionGate": {"const": "NOT_REQUIRED"}}, "required": ["decisionGate"]},
          "then": {"properties": {"approvalDecisionIds": {"maxItems": 0}}}
        },
        {
          "if": {"properties": {"decisionGate": {"const": "REQUIRED"}}, "required": ["decisionGate"]},
          "then": {"properties": {"approvalDecisionIds": {"minItems": 1}}}
        }
      ]
    },
    "assumption": {
      "type": "object",
      "additionalProperties": false,
      "required": ["assumptionId", "type", "name", "trigger", "responsibilityBoundary", "status", "handling"],
      "properties": {
        "assumptionId": {"$ref": "#/$defs/assumptionId", "description": "稳定识别一项不重复的交付 Assumption 或 Risk。"},
        "type": {"type": "string", "enum": ["假设", "风险"], "description": "依据当前证据把该条件识别为计划假设或可能发生的风险。"},
        "name": {"type": "string", "minLength": 1, "description": "清楚概括未知条件或风险事件的名称。"},
        "trigger": {"type": "string", "minLength": 1, "description": "使该项需要处置的可观察条件、日期或事件。"},
        "responsibilityBoundary": {"type": "string", "minLength": 1, "description": "明确由哪一方提供决定、证据、修复或范围变更。"},
        "status": {"type": "string", "enum": ["已明确", "待确认"], "description": "该假设或风险的责任与处置是否已经确认。"},
        "handling": {"type": "string", "minLength": 1, "description": "说明接受、缓解、升级或由 Story 解决的方式；消费问卷默认项时保留 Question ID 锚点。"}
      }
    }
  }
}
