{
  "stories": [
    {
      "storyId": "story-customer-profile",
      "name": "创建并查看客户档案",
      "description": "交付档案扩展字段、校验、授权展示和可追溯查看流程。",
      "uatRelevant": true,
      "requiredIntegrationBoundary": "NONE",
      "featureId": "feature-customer-profile"
    },
    {
      "storyId": "story-profile-api",
      "name": "提供客户档案操作",
      "description": "交付客户档案创建、维护和检索 API。",
      "uatRelevant": true,
      "requiredIntegrationBoundary": "END_TO_END",
      "featureId": "feature-profile-api"
    },
    {
      "storyId": "story-profile-integration",
      "name": "集成会员主数据查询",
      "description": "会员门户通过内部接口查询统一会员号和授权范围内的档案。",
      "assumptionId": "assumption-profile-api-availability",
      "uatRelevant": true,
      "requiredIntegrationBoundary": "END_TO_END",
      "featureId": "feature-profile-api"
    },
    {
      "storyId": "story-member-tier",
      "name": "计算并追溯会员等级",
      "description": "按生效规则计算等级并展示规则版本与等级历史。",
      "assumptionId": "assumption-profile-api-availability",
      "uatRelevant": true,
      "requiredIntegrationBoundary": "NONE",
      "featureId": "feature-member-tier"
    },
    {
      "storyId": "story-order-create",
      "name": "统一创建全渠道订单",
      "description": "门店和线上渠道使用统一校验创建订单。",
      "uatRelevant": true,
      "requiredIntegrationBoundary": "NONE",
      "featureId": "feature-order-orchestration"
    },
    {
      "storyId": "story-order-state",
      "name": "驱动订单状态与事件",
      "description": "订单命令按状态机幂等执行并发布可追踪事件。",
      "uatRelevant": true,
      "requiredIntegrationBoundary": "NONE",
      "featureId": "feature-order-orchestration"
    },
    {
      "storyId": "story-inventory-reservation",
      "name": "预占和释放 ERP 库存",
      "description": "订单确认或取消时调用 ERP，并处理超时、重试和重复请求。",
      "assumptionId": "assumption-erp-sit-window",
      "uatRelevant": true,
      "requiredIntegrationBoundary": "END_TO_END",
      "featureId": "feature-inventory-reservation"
    },
    {
      "storyId": "story-return-request",
      "name": "提交并审核退货申请",
      "description": "门店或客服提交退货，系统校验可退数量并记录审核结果。",
      "uatRelevant": true,
      "requiredIntegrationBoundary": "END_TO_END",
      "featureId": "feature-return-refund"
    },
    {
      "storyId": "story-refund-payment",
      "name": "发起退款并回写结果",
      "description": "通过外部支付网关发起退款，处理异步结果并回写订单。",
      "assumptionId": "assumption-risk-payment-certification",
      "uatRelevant": true,
      "requiredIntegrationBoundary": "END_TO_END",
      "featureId": "feature-return-refund"
    },
    {
      "storyId": "story-store-order",
      "name": "门店处理订单与交接",
      "description": "门店查看待处理订单、记录缺货替代并完成班次交接。",
      "uatRelevant": true,
      "requiredIntegrationBoundary": "NONE",
      "featureId": "feature-store-order"
    },
    {
      "storyId": "story-order-visibility",
      "name": "查看统一履约轨迹",
      "description": "顾客和客服查看同一套状态、节点与异常原因。",
      "uatRelevant": true,
      "requiredIntegrationBoundary": "NONE",
      "featureId": "feature-order-visibility"
    },
    {
      "storyId": "story-payment-reconciliation",
      "name": "执行支付退款日结对账",
      "description": "每日汇总交易并标识实收、退款和手续费差异。",
      "uatRelevant": true,
      "requiredIntegrationBoundary": "NONE",
      "featureId": "feature-payment-reconciliation"
    },
    {
      "storyId": "story-einvoice",
      "name": "申请并追踪电子发票",
      "description": "提交开票申请，查询状态并处理可重试失败。",
      "assumptionId": "assumption-risk-invoice-certificate",
      "uatRelevant": true,
      "requiredIntegrationBoundary": "END_TO_END",
      "featureId": "feature-einvoice"
    },
    {
      "storyId": "story-finance-report",
      "name": "查看财务经营日报",
      "description": "按日期、区域和渠道查看销售、退款、优惠和未对账金额。",
      "uatRelevant": true,
      "requiredIntegrationBoundary": "NONE",
      "featureId": "feature-finance-report"
    },
    {
      "storyId": "story-production-preparation",
      "name": "准备生产环境和发布流水线",
      "description": "完成应用配置、制品部署、权限和功能开关准备。",
      "uatRelevant": false,
      "requiredIntegrationBoundary": "END_TO_END",
      "featureId": "feature-production-scope"
    },
    {
      "storyId": "story-production-cutover",
      "name": "执行生产切换与回滚演练",
      "description": "按批准窗口执行分步切流，并验证回滚清单可执行。",
      "assumptionId": "assumption-migration-freeze-window",
      "uatRelevant": false,
      "requiredIntegrationBoundary": "END_TO_END",
      "featureId": "feature-production-scope"
    },
    {
      "storyId": "story-production-validation",
      "name": "完成生产烟测与业务确认",
      "description": "上线后验证档案、下单、退款、开票和对账关键链路。",
      "assumptionId": "assumption-risk-profile-alert-channel",
      "uatRelevant": true,
      "requiredIntegrationBoundary": "END_TO_END",
      "featureId": "feature-production-scope"
    },
    {
      "storyId": "story-data-migration",
      "name": "迁移会员与历史订单数据",
      "description": "执行抽取、映射、加载、校验和失败补偿。",
      "assumptionId": "assumption-migration-freeze-window",
      "uatRelevant": false,
      "requiredIntegrationBoundary": "NONE",
      "featureId": "feature-data-migration"
    },
    {
      "storyId": "story-observability",
      "name": "监控核心交易与财务作业",
      "description": "新增指标、阈值、告警和责任人看板。",
      "assumptionId": "assumption-risk-profile-alert-channel",
      "uatRelevant": false,
      "requiredIntegrationBoundary": "NONE",
      "featureId": "feature-observability-ops"
    },
    {
      "storyId": "story-ops-handover",
      "name": "完成运维交接与演练",
      "description": "提交运维手册、联系人和处置流程并完成演练。",
      "uatRelevant": false,
      "requiredIntegrationBoundary": "NONE",
      "featureId": "feature-observability-ops"
    },
    {
      "storyId": "story-user-training",
      "name": "培训门店、客服和财务用户",
      "description": "提供角色化材料并完成两场培训和签到验收。",
      "uatRelevant": true,
      "requiredIntegrationBoundary": "NONE",
      "featureId": "feature-observability-ops"
    },
    {
      "storyId": "story-test-automation",
      "name": "扩展自动化与性能验证",
      "description": "调整框架和用例，覆盖核心 API、状态机和峰值场景。",
      "uatRelevant": false,
      "requiredIntegrationBoundary": "END_TO_END",
      "featureId": "feature-test-quality"
    },
    {
      "storyId": "story-test-non-uat",
      "name": "执行兼容性与工程回归",
      "description": "验证支持的浏览器、设备矩阵和工程回归范围。",
      "uatRelevant": false,
      "requiredIntegrationBoundary": "END_TO_END",
      "featureId": "feature-test-quality"
    }
  ],
  "acceptanceCriteria": [
    {
      "acceptanceCriterionId": "ac-profile-visible",
      "storyId": "story-customer-profile",
      "sequence": 1,
      "name": "用户保存档案后可以查看授权范围内的最新字段。",
      "decisionGate": "NOT_REQUIRED",
      "approvalDecisionIds": [],
      "gapRationale": "无与本验收结果等价的 Effective Start：现有框架缺少一期顺延字段、授权过滤和统一查看体验。",
      "carryForwardCommitmentIds": [
        "commitment-profile-fields"
      ]
    },
    {
      "acceptanceCriterionId": "ac-profile-audit",
      "storyId": "story-customer-profile",
      "sequence": 2,
      "name": "档案变更记录包含操作者、时间和变更字段。",
      "decisionGate": "NOT_REQUIRED",
      "approvalDecisionIds": [],
      "gapRationale": "无与本验收结果等价的 Effective Start：现有框架缺少一期顺延字段、授权过滤和统一查看体验。",
      "carryForwardCommitmentIds": []
    },
    {
      "acceptanceCriterionId": "ac-profile-api",
      "storyId": "story-profile-api",
      "sequence": 1,
      "name": "渠道可以通过已发布 API 创建、维护和检索客户档案。",
      "decisionGate": "REQUIRED",
      "approvalDecisionIds": [
        "decision-profile-api"
      ],
      "gapRationale": "无与本验收结果等价的 Effective Start：渠道与会员主数据之间没有稳定、可审计的操作边界。",
      "carryForwardCommitmentIds": []
    },
    {
      "acceptanceCriterionId": "ac-profile-api-security",
      "storyId": "story-profile-api",
      "sequence": 2,
      "name": "未授权角色无法读取敏感字段且访问留痕。",
      "decisionGate": "NOT_REQUIRED",
      "approvalDecisionIds": [],
      "gapRationale": "无与本验收结果等价的 Effective Start：渠道与会员主数据之间没有稳定、可审计的操作边界。",
      "carryForwardCommitmentIds": []
    },
    {
      "acceptanceCriterionId": "ac-profile-integration",
      "storyId": "story-profile-integration",
      "sequence": 1,
      "name": "星云会员门户可以通过内部接口检索统一会员号和档案。",
      "decisionGate": "REQUIRED",
      "approvalDecisionIds": [
        "decision-profile-api"
      ],
      "gapRationale": "无与本验收结果等价的 Effective Start：渠道与会员主数据之间没有稳定、可审计的操作边界。",
      "carryForwardCommitmentIds": []
    },
    {
      "acceptanceCriterionId": "ac-member-tier",
      "storyId": "story-member-tier",
      "sequence": 1,
      "name": "会员等级按生效规则计算且可以追溯规则版本。",
      "decisionGate": "NOT_REQUIRED",
      "approvalDecisionIds": [],
      "gapRationale": "无与本验收结果等价的 Effective Start：现有会员主数据只保存当前等级，无法追溯规则与变更。",
      "carryForwardCommitmentIds": []
    },
    {
      "acceptanceCriterionId": "ac-member-tier-history",
      "storyId": "story-member-tier",
      "sequence": 2,
      "name": "等级调整后保留原等级、生效时间和调整原因。",
      "decisionGate": "NOT_REQUIRED",
      "approvalDecisionIds": [],
      "gapRationale": "无与本验收结果等价的 Effective Start：现有会员主数据只保存当前等级，无法追溯规则与变更。",
      "carryForwardCommitmentIds": []
    },
    {
      "acceptanceCriterionId": "ac-order-create",
      "storyId": "story-order-create",
      "sequence": 1,
      "name": "门店和线上渠道通过相同校验规则创建订单。",
      "decisionGate": "NOT_REQUIRED",
      "approvalDecisionIds": [],
      "gapRationale": "无与本验收结果等价的 Effective Start：线上和门店订单缺少统一命令、状态机和审计轨迹。",
      "carryForwardCommitmentIds": []
    },
    {
      "acceptanceCriterionId": "ac-order-idempotency",
      "storyId": "story-order-create",
      "sequence": 2,
      "name": "相同幂等键的重复请求不产生重复订单。",
      "decisionGate": "NOT_REQUIRED",
      "approvalDecisionIds": [],
      "gapRationale": "无与本验收结果等价的 Effective Start：线上和门店订单缺少统一命令、状态机和审计轨迹。",
      "carryForwardCommitmentIds": []
    },
    {
      "acceptanceCriterionId": "ac-order-state",
      "storyId": "story-order-state",
      "sequence": 1,
      "name": "合法命令驱动状态变化并记录来源、时间和事件编号。",
      "decisionGate": "NOT_REQUIRED",
      "approvalDecisionIds": [],
      "gapRationale": "无与本验收结果等价的 Effective Start：线上和门店订单缺少统一命令、状态机和审计轨迹。",
      "carryForwardCommitmentIds": []
    },
    {